{
  "$schema": "http://json-schema.org/draft-07/schema#",
  "$id": "https://forepath.dev/schemas/forepath.extension.schema.json",
  "title": "ForepathExtensionManifest",
  "type": "object",
  "required": ["id", "kind", "name", "description"],
  "additionalProperties": true,
  "properties": {
    "$schema": {
      "type": "string"
    },
    "id": {
      "type": "string",
      "minLength": 1
    },
    "kind": {
      "type": "string",
      "minLength": 1
    },
    "name": {
      "type": "string",
      "minLength": 1
    },
    "description": {
      "type": "string",
      "minLength": 1
    },
    "version": {
      "type": "string",
      "minLength": 1
    },
    "entrypoint": {
      "type": "string",
      "minLength": 1
    }
  }
}
