{
  "$schema": "../../../shared/backend/util-extension-core/src/schemas/forepath.extension.schema.json",
  "id": "database-regex-incoming",
  "kind": "chat-filter",
  "name": "ChatFilterDbRegexIncoming",
  "description": "Chat Filter Db Regex Incoming chat filter extension.",
  "version": "0.0.0"
}
